{
  "id": "react-web",
  "displayName": "React Web",
  "targetStackId": "ts-react-vite",
  "generatedPaths": [
    "AGENTS.md",
    "CLAUDE.md",
    "GEMINI.md",
    "README-humanlint-scaffold.md",
    ".agents/agents.md",
    ".agents/skills/humanlint/SKILL.md",
    ".agents/workflows/humanlint-audit.md",
    ".claude/skills/humanlint/SKILL.md",
    ".cursor/rules/humanlint.mdc",
    ".github/copilot-instructions.md",
    ".github/instructions/humanlint.instructions.md",
    ".github/instructions/humanlint-web.instructions.md",
    ".github/workflows/humanlint.yml",
    "agent/HUMANLINT_STANDARD.md",
    "agent/MASTER_PLAN.md",
    "agent/audit-policy.toml",
    "agent/boundaries.toml",
    "agent/generated-zones.toml",
    "agent/owner-map.json",
    "agent/proof-lanes.toml",
    "agent/standard-version.toml",
    "agent/test-map.json",
    "agent/ux-qa.toml",
    "contracts/README.md",
    "docs/agent-native-standard.md",
    "docs/architecture/README.md",
    "docs/decisions/README.md",
    "docs/exceptions/README.md",
    "docs/ide-integrations.md",
    "docs/install.md",
    "tools/security-lane.sh"
  ],
  "requiredLanes": ["fast", "audit", "ux", "security"],
  "optionalLanes": [],
  "agentAdapters": [
    ".cursor/rules/humanlint.mdc",
    "CLAUDE.md",
    "GEMINI.md",
    ".github/copilot-instructions.md",
    ".github/instructions/humanlint.instructions.md",
    ".github/instructions/humanlint-web.instructions.md",
    ".agents/agents.md",
    ".agents/skills/humanlint/SKILL.md",
    ".agents/workflows/humanlint-audit.md",
    ".claude/skills/humanlint/SKILL.md"
  ],
  "ciTemplates": [".github/workflows/humanlint.yml"],
  "docs": [
    "docs/install.md",
    "docs/agent-native-standard.md",
    "docs/ide-integrations.md",
    "docs/exceptions/README.md",
    "docs/architecture/README.md",
    "docs/decisions/README.md"
  ],
  "securityControls": ["agent/audit-policy.toml", "agent/boundaries.toml", "tools/security-lane.sh"],
  "uxControls": ["agent/ux-qa.toml"],
  "contractSystem": [
    "agent/owner-map.json",
    "agent/test-map.json",
    "agent/generated-zones.toml",
    "agent/proof-lanes.toml",
    "contracts/README.md"
  ],
  "dbPolicy": [],
  "validationCommands": [
    "cargo test -p humanlint",
    "just fast",
    "npm --workspace @humanlint/ux-qa run build",
    "npm --workspace @humanlint/ux-qa run test"
  ]
}
