{
  "id": "migration-target",
  "displayName": "Migration Target",
  "targetStackId": "migration-target",
  "generatedPaths": [
    "AGENTS.md",
    "CLAUDE.md",
    "GEMINI.md",
    "README-jankurai-scaffold.md",
    ".agents/agents.md",
    ".agents/skills/jankurai/SKILL.md",
    ".agents/workflows/jankurai-audit.md",
    ".claude/skills/jankurai/SKILL.md",
    ".cursor/rules/jankurai.mdc",
    ".github/copilot-instructions.md",
    ".github/instructions/jankurai.instructions.md",
    ".github/instructions/jankurai-rust.instructions.md",
    ".github/workflows/jankurai.yml",
    "agent/JANKURAI_STANDARD.md",
    "agent/MASTER_PLAN.md",
    "agent/audit-policy.toml",
    "agent/boundaries.toml",
    "agent/security-policy.toml",
    "agent/generated-zones.toml",
    "agent/owner-map.json",
    "agent/proof-lanes.toml",
    "agent/standard-version.toml",
    "agent/test-map.json",
    "contracts/README.md",
    "docs/agent-native-standard.md",
    "docs/architecture/README.md",
    "docs/decisions/README.md",
    "docs/exceptions/README.md",
    "docs/ide-integrations.md",
    "docs/install.md",
    "docs/migration/README.md",
    "docs/migration/boundary-map.md",
    "docs/migration/slices/README.md",
    "tools/security-lane.sh"
  ],
  "requiredLanes": ["fast", "audit", "security"],
  "optionalLanes": ["migration"],
  "agentAdapters": [
    ".cursor/rules/jankurai.mdc",
    "CLAUDE.md",
    "GEMINI.md",
    ".github/copilot-instructions.md",
    ".github/instructions/jankurai.instructions.md",
    ".github/instructions/jankurai-rust.instructions.md",
    ".agents/agents.md",
    ".agents/skills/jankurai/SKILL.md",
    ".agents/workflows/jankurai-audit.md",
    ".claude/skills/jankurai/SKILL.md"
  ],
  "ciTemplates": [".github/workflows/jankurai.yml"],
  "docs": [
    "docs/install.md",
    "docs/agent-native-standard.md",
    "docs/ide-integrations.md",
    "docs/exceptions/README.md",
    "docs/architecture/README.md",
    "docs/decisions/README.md",
    "docs/migration/README.md",
    "docs/migration/boundary-map.md",
    "docs/migration/slices/README.md"
  ],
  "securityControls": ["agent/audit-policy.toml", "agent/boundaries.toml", "agent/security-policy.toml", "tools/security-lane.sh"],
  "uxControls": [],
  "contractSystem": [
    "agent/owner-map.json",
    "agent/test-map.json",
    "agent/generated-zones.toml",
    "agent/proof-lanes.toml",
    "contracts/README.md"
  ],
  "dbPolicy": ["agent/boundaries.toml"],
  "validationCommands": [
    "cargo test -p jankurai",
    "just fast"
  ]
}
